{
  "$schema": "https://json-schema.org/draft/2020-12/schema",
  "title": "Plan Mutation Entry",
  "description": "One JSONL line in plan-mutations.jsonl, recording any change to plan.yaml or RoE/scope after engagement creation.",
  "type": "object",
  "required": ["timestamp", "source", "actor", "mutation_kind", "before", "after", "reason"],
  "additionalProperties": false,
  "properties": {
    "timestamp": { "type": "string", "format": "date-time" },
    "source": { "enum": ["initial", "amendment", "supervisor", "resume"] },
    "actor": { "enum": ["conductor", "pentest-supervisor", "user"] },
    "mutation_kind": {
      "enum": [
        "phase_added", "phase_skipped", "phase_unlocked", "phase_rerun",
        "scope_added", "scope_removed",
        "roe_changed", "rate_limit_changed",
        "objective_added"
      ]
    },
    "before": {},
    "after": {},
    "reason": { "type": "string", "minLength": 1 }
  }
}
